### ISSUE TITLE
Caddy HTTP/3 timing out

### ISSUE THREAD

**Issue by natesales** [lucas-clemente/quic-go#2922]
I'm running https://arix.dev with the Caddy webserver (using quic-go) and am having some trouble with HTTP over QUIC. The site does pass the https://gf.dev/http3-test HTTP/3 test, although quiche+curl and chrome with `--enable-http3 --quic-version=h3-29` are unable to complete the QUIC transport. Chrome falls back to HTTP/2, and curl times out like so:

```
~/apps/http3/curl/src ▴ ./curl -v -I --http3 https://arix.dev
*   Trying 2a0e:8f00:fe04::4:443...
* Sent QUIC client Initial, ALPN: h3-29,h3-28,h3-27
*   Trying 66.248.234.4:443...
* Sent QUIC client Initial, ALPN: h3-29,h3-28,h3-27
* After 149794ms connect time, move on!
* connect to 2a0e:8f00:fe04::4 port 443 failed: Connection timed out
* After 149794ms connect time, move on!
* connect to 66.248.234.4 port 443 failed: Connection timed out
* Failed to connect to arix.dev port 443: Connection timed out
* Closing connection 0
curl: (28) Failed to connect to arix.dev port 443: Connection timed out
```

Taking a look at a packet capture, I'm seeing repeated outbound UDP packets, and no traffic coming back from the server.

The webserver is responding with an alt-svc header (over older HTTP versions) advertising `Alt-Svc: h3-29=":443"; ma=2592000`

I am able to make a request to https://quic.tech:8443

```
~/apps/http3/curl/src ▴ ./curl -v -I --http3 https://quic.tech:8443
*   Trying 2001:19f0:5:c21:5400:1ff:fe33:3b96:8443...
* Sent QUIC client Initial, ALPN: h3-29,h3-28,h3-27
* Connected to quic.tech (2001:19f0:5:c21:5400:1ff:fe33:3b96) port 8443 (#0)
* h3 [:method: HEAD]
* h3 [:path: /]
* h3 [:scheme: https]
* h3 [:authority: quic.tech:8443]
* h3 [user-agent: curl/7.74.0-DEV]
* h3 [accept: */*]
* Using HTTP/3 Stream ID: 0 (easy handle 0x557b80778af0)
> HEAD / HTTP/3
> Host: quic.tech:8443
> user-agent: curl/7.74.0-DEV
> accept: */*
> 
< HTTP/3 405
HTTP/3 405
< server: quiche
server: quiche
< content-length: 0
content-length: 0
< priority: 
priority: 
* Connection #0 to host quic.tech left intact
```

Let me know if this is the wrong repo to be filing an issue in, and if this would be better suited for Caddy itself. I figured as Caddy is using quic-go as it's underlying QUIC implementation, this would be most appropriate.

**Comment by marten-seemann** [comment]
Can you post the packet capture / qlog here?

**Comment by natesales** [comment]
Sure, I'm seeing the following on the client

```
15:11:37.054752 IP6 altair.38532 > 2a0e:8f00:fe04::4.443: UDP, length 1200
15:11:38.053579 IP6 altair.38532 > 2a0e:8f00:fe04::4.443: UDP, length 1200
15:11:40.051591 IP6 altair.38532 > 2a0e:8f00:fe04::4.443: UDP, length 1200
15:11:40.051602 IP6 altair.38532 > 2a0e:8f00:fe04::4.443: UDP, length 1200
15:11:44.047696 IP6 altair.38532 > 2a0e:8f00:fe04::4.443: UDP, length 1200
15:11:44.047720 IP6 altair.38532 > 2a0e:8f00:fe04::4.443: UDP, length 1200
15:11:52.039774 IP6 altair.38532 > 2a0e:8f00:fe04::4.443: UDP, length 1200
15:11:52.039809 IP6 altair.38532 > 2a0e:8f00:fe04::4.443: UDP, length 1200
```

**Comment by marten-seemann** [comment]
You're never getting a response from the server. That could mean that UDP packets are dropped in the network, or that the server is dropping them. No way to tell from the pcap.

Please run quic-go with QUIC_GO_LOG_LEVEL=debug to see what's going on.

**Comment by natesales** [comment]
Here's the logs with debug enabled (truncating some long lines):
```
2020/12/08 15:49:31 server <- Received Initial packet.
2020/12/08 15:49:31 server 	Long Header{Type: Initial, DestConnectionID: 0x563ef68cdcc131aeb4c9b4a8e2fde47b, SrcConnectionID: 0x909cdc671fc07c3c98cd902ad96a69a63a8d8ecd, Token: (empty), PacketNumber: 0, PacketNumberLen: 0, Length: 1154, Version: QUIC WG draft-29}
2020/12/08 15:49:31 server Changing connection ID to 0x663f8cbf.
2020/12/08 15:49:31 server -> Sending Retry
2020/12/08 15:49:31 server 	Long Header{Type: Retry, DestConnectionID: 0x909cdc671fc07c3c98cd902ad96a69a63a8d8ecd, SrcConnectionID: 0x663f8cbf, Token: 0x156993<truncated>48855, Version: QUIC WG draft-29}
2020/12/08 15:49:31 server <- Received Initial packet.
2020/12/08 15:49:31 server 	Long Header{Type: Initial, DestConnectionID: 0xb4bd905bc27719bc880db550c6e1fbb8, SrcConnectionID: 0x99772582c7d3a4ca98fb5c3fa5c43230701c4f32, Token: (empty), PacketNumber: 0, PacketNumberLen: 0, Length: 1154, Version: QUIC WG draft-29}
2020/12/08 15:49:31 server Changing connection ID to 0xa5fc3b75.
2020/12/08 15:49:31 server -> Sending Retry
2020/12/08 15:49:31 server 	Long Header{Type: Retry, DestConnectionID: 0x99772582c7d3a4ca98fb5c3fa5c43230701c4f32, SrcConnectionID: 0xa5fc3b75, Token: 0x91833f<truncated>8f2a, Version: QUIC WG draft-29}
2020/12/08 15:49:32 server <- Received Initial packet.
2020/12/08 15:49:32 server 	Long Header{Type: Initial, DestConnectionID: 0x563ef68cdcc131aeb4c9b4a8e2fde47b, SrcConnectionID: 0x909cdc671fc07c3c98cd902ad96a69a63a8d8ecd, Token: (empty), PacketNumber: 0, PacketNumberLen: 0, Length: 1154, Version: QUIC WG draft-29}
2020/12/08 15:49:32 server Changing connection ID to 0xdb3ee922.
2020/12/08 15:49:32 server -> Sending Retry
2020/12/08 15:49:32 server 	Long Header{Type: Retry, DestConnectionID: 0x909cdc671fc07c3c98cd902ad96a69a63a8d8ecd, SrcConnectionID: 0xdb3ee922, Token: 0x80c<truncated>e71d8d, Version: QUIC WG draft-29}
2020/12/08 15:49:32 server <- Received Initial packet.
2020/12/08 15:49:32 server 	Long Header{Type: Initial, DestConnectionID: 0xb4bd905bc27719bc880db550c6e1fbb8, SrcConnectionID: 0x99772582c7d3a4ca98fb5c3fa5c43230701c4f32, Token: (empty), PacketNumber: 0, PacketNumberLen: 0, Length: 1154, Version: QUIC WG draft-29}
2020/12/08 15:49:32 server Changing connection ID to 0x330a00ba.
```

**Comment by marten-seemann** [comment]
The client doesn't respond to the Retry packets, it just continues sending Initial packets, alternating between the DCIDs `563ef68cdcc131aeb4c9b4a8e2fde47b` and `b4bd905bc27719bc880db550c6e1fbb8`.
Why's that? You'd probably have to turn on logging on the client side.

**Comment by natesales** [comment]
Got it, how would I get more verbose logs with the client? The -v flag in curl doesn't show as much information about the QUIC as is needed.

**Comment by marten-seemann** [comment]
Not sure about the internals of curl / quiche, but it seems like the issue might be on their side instead of on quic-go's. Interestingly, the interop tests on the [interop runner](https://interop.seemann.io) seem to succeed.

Maybe you could open issue with them? If you do so, please link it here, I'm very interested in the resolution.

**Comment by marten-seemann** [comment]
Closing due to inactivity.
