### ISSUE TITLE
MaxIdleTimeout not respected

### ISSUE THREAD

**Issue by apmattil** [lucas-clemente/quic-go#3043]
setting MaxIdleTimeout to zero should make library to send keepalive ping per 10 sec.
When server side keepalive is disabled and client MaxIdleTimeout  zero I get pings sent before 10 sec.

also setting ping to any other value does not seem to take any effect.
if I read the code correctly, max value is 20 sec:
`s.keepAliveInterval = utils.MinDuration(s.idleTimeout/2, protocol.MaxKeepAliveInterval)`
so documentation is miss leading:
```	// MaxIdleTimeout is the maximum duration that may pass without any incoming network activity.
	// The actual value for the idle timeout is the minimum of this value and the peer's.
	// This value only applies after the handshake has completed.
	// If the timeout is exceeded, the connection is closed.
	// If this value is zero, the timeout is set to 30 seconds.
	MaxIdleTimeout time.Duration
```

```Sending a keep-alive PING to keep the connection alive.2021/02/15 17:19:55 client Sending a keep-alive PING to keep the connection alive.
2021/02/15 17:19:55 client -> Sending packet 29 (25 bytes) for connection 0x7c1fdb253ed72629d37e, 1-RTT
2021/02/15 17:19:55 client      Short Header{DestConnectionID: 0xce845ce9, PacketNumber: 29, PacketNumberLen: 2, KeyPhase: 0}
2021/02/15 17:19:55 client      -> &wire.PingFrame{}
2021/02/15 17:19:55 client <- Reading packet 24 (35 bytes) for connection 0x33fc2675, 1-RTT
2021/02/15 17:19:55 client      Short Header{DestConnectionID: 0x33fc2675, PacketNumber: 24, PacketNumberLen: 2, KeyPhase: 0}
2021/02/15 17:19:55 client      <- &wire.AckFrame{LargestAcked: 29, LowestAcked: 17, AckRanges: {{Largest: 29, Smallest: 27}, {Largest: 25, Smallest: 24}, {Largest: 22, Smallest: 21}, {Largest: 19, Smallest: 17}}, DelayTime: 25.136ms}
2021/02/15 17:19:55 client      newly acked packets (1): [29]
2021/02/15 17:19:55 client      updated RTT: 205.597ms (?: 261.888ms)
2021/02/15 17:19:55 client Canceling loss detection timer. No packets in flight.
2021/02/15 17:19:57 muxer Tracking 3 connection IDs and 1 reset tokens.
2021/02/15 17:19:59 muxer Tracking 3 connection IDs and 1 reset tokens.
2021/02/15 17:20:01 muxer Tracking 3 connection IDs and 1 reset tokens.
2021/02/15 17:20:03 muxer Tracking 3 connection IDs and 1 reset tokens.
Sending a keep-alive PING to keep the connection alive.2021/02/15 17:20:03 client Sending a keep-alive PING to keep the connection alive.
2021/02/15 17:20:03 client -> Sending packet 30 (25 bytes) for connection 0x7c1fdb253ed72629d37e, 1-RTT
2021/02/15 17:20:03 client      Short Header{DestConnectionID: 0xce845ce9, PacketNumber: 30, PacketNumberLen: 2, KeyPhase: 0}
2021/02/15 17:20:03 client      -> &wire.PingFrame{}
2021/02/15 17:20:03 client <- Reading packet 25 (35 bytes) for connection 0x33fc2675, 1-RTT
2021/02/15 17:20:03 client      Short Header{DestConnectionID: 0x33fc2675, PacketNumber: 25, PacketNumberLen: 2, KeyPhase: 0}
2021/02/15 17:20:03 client      <- &wire.AckFrame{LargestAcked: 30, LowestAcked: 17, AckRanges: {{Largest: 30, Smallest: 27}, {Largest: 25, Smallest: 24}, {Largest: 22, Smallest: 21}, {Largest: 19, Smallest: 17}}, DelayTime: 25.152ms}
2021/02/15 17:20:03 client      newly acked packets (1): [30]
2021/02/15 17:20:03 client      updated RTT: 179.99ms (?: 247.628ms)
2021/02/15 17:20:03 client Canceling loss detection timer. No packets in flight.
2021/02/15 17:20:05 muxer Tracking 3 connection IDs and 1 reset tokens.
2021/02/15 17:20:07 muxer Tracking 3 connection IDs and 1 reset tokens.
2021/02/15 17:20:09 muxer Tracking 3 connection IDs and 1 reset tokens.
Sending a keep-alive PING to keep the connection alive.2021/02/15 17:20:10 client Sending a keep-alive PING to keep the connection alive.
2021/02/15 17:20:10 client -> Sending packet 31 (25 bytes) for connection 0x7c1fdb253ed72629d37e, 1-RTT
2021/02/15 17:20:10 client      Short Header{DestConnectionID: 0xce845ce9, PacketNumber: 31, PacketNumberLen: 2, KeyPhase: 0}
2021/02/15 17:20:10 client      -> &wire.PingFrame{}
2021/02/15 17:20:11 client <- Reading packet 26 (35 bytes) for connection 0x33fc2675, 1-RTT
2021/02/15 17:20:11 client      Short Header{DestConnectionID: 0x33fc2675, PacketNumber: 26, PacketNumberLen: 2, KeyPhase: 0}
2021/02/15 17:20:11 client      <- &wire.AckFrame{LargestAcked: 31, LowestAcked: 17, AckRanges: {{Largest: 31, Smallest: 27}, {Largest: 25, Smallest: 24}, {Largest: 22, Smallest: 21}, {Largest: 19, Smallest: 17}}, DelayTime: 25.152ms}
2021/02/15 17:20:11 client      newly acked packets (1): [31]
2021/02/15 17:20:11 client      updated RTT: 157.617ms (?: 230.465ms)
2021/02/15 17:20:11 client Canceling loss detection timer. No packets in flight.
```
tcpdump from server :
```
17:19:55.926278 IP 10.12.0.191.48137 > 10.12.0.204.443: UDP, length 25
17:19:55.951592 IP 10.12.0.204.443 > 10.12.0.191.48137: UDP, length 35
17:20:03.452581 IP 10.12.0.191.48137 > 10.12.0.204.443: UDP, length 25
17:20:03.477937 IP 10.12.0.204.443 > 10.12.0.191.48137: UDP, length 35
17:20:10.978906 IP 10.12.0.191.48137 > 10.12.0.204.443: UDP, length 25
17:20:11.004292 IP 10.12.0.204.443 > 10.12.0.191.48137: UDP, length 35
```

**Comment by apmattil** [comment]
I was trying to set keepalive interval via MaxIdleTimeout, it is not configurable via this.
